questID,questTitle,questDescription,triggerMapName,triggerRow,triggerColumn,experiencePointsGained,objectivesForFulfillment,completionActionType,completionActionParameter,startDate,endDate
100,Introductory Quest,"Welcome!  For your first quest, you need to learn a little bit about this world.  Press Q to see what you need to do.  Double clicking on a quest in the quest screen will show you its objectives.",StartingRoom.tmx,2,32,5,11,0,0xACED00057372001863726974657269612E47616D654C6F636174696F6E44544F00000000000000010200024C00076D61704E616D657400124C6A6176612F6C616E672F537472696E673B4C0008706F736974696F6E7400144C6461746174797065732F506F736974696F6E3B7870740008717561642E746D78737200126461746174797065732E506F736974696F6E0000000000000001020002490006636F6C756D6E490003726F777870000000070000005C,2022-08-31,2022-12-25
101,Exploration,Explore your new school,sortingRoom.tmx,4,13,2,5,1,,2022-08-31,2022-12-25
103,Meet The Tutor,Talk with the NPC tutor.,library.tmx,1,1,10,1,2,0xACED00057372002563726974657269612E51756573744C697374436F6D706C6574696F6E506172616D6574657200000000000000010200014C000871756573744944737400154C6A6176612F7574696C2F41727261794C6973743B7870737200136A6176612E7574696C2E41727261794C6973747881D21D99C7619D03000149000473697A65787000000001770400000001737200116A6176612E6C616E672E496E746567657212E2A0A4F781873802000149000576616C7565787200106A6176612E6C616E672E4E756D62657286AC951D0B94E08B02000078700000006678,2022-08-31,2022-12-25
104,Curiouser and Curiouser!,Find the special tea recipe in The Green.,quad.tmx,92,7,2,1,1,,2022-08-31,2022-12-25
105,Flowers for Tea,TEAcher wants to try that tea recipe you found. Find four flowers to help him make it.,quad.tmx,92,7,1,5,1,,2022-08-31,2022-12-25
106,Solving Riddles,You need to solve these riddles by finding to locations that they describe. Good Luck!,quad.tmx,92,7,10,3,1,,2022-08-31,2022-12-25
107,Roshambo,"A mysterious figure issues you a challenge, but first you must find the secret password...",quad.tmx,92,7,1,2,1,,2022-08-31,2022-12-25
